variable_name,variable_name_in_database,bican_uuid,short_name,full_name,value_type,parent_id,parent_name,resource_category,parent_id,min,max,numeric_type,step,unit,dependent_name,options
,,,Enriched Cell Sample,Enriched Cell Sample,,,,,,,,,,,,
enriched_cell_sample_local_name,local_name,bb3fc701-23a7-45c1-890d-7471730e0ec1,Enriched Cell Sample Local Name / Identifier,Enriched Cell Sample Local Name / Identifier,text,,Enriched Cell Sample,Enriched Cell Sample,,,,,,,,
enriched_cell_sample_nhash_id,study_id,,Enriched Cell Sample NHash ID,Enriched Cell Sample NHash ID,text,,Enriched Cell Sample,Enriched Cell Sample,,,,,,,,
enriched_cell_sample_cell_label_barcode,bar_code,,Enriched Cell Sample Cell Label Barcode,Enriched Cell Sample Cell Label Barcode,categorical,,Enriched Cell Sample,Enriched Cell Sample,,,,,,,,CMO301/#/10x Cell Plex oligo tag for multiplexing tissue sources into a single 10x load./#/|CMO302/#/10x Cell Plex oligo tag for multiplexing tissue sources into a single 10x load./#/|CMO303/#/10x Cell Plex oligo tag for multiplexing tissue sources into a single 10x load./#/|CMO304/#/10x Cell Plex oligo tag for multiplexing tissue sources into a single 10x load./#/|CMO305/#/10x Cell Plex oligo tag for multiplexing tissue sources into a single 10x load./#/|CMO306/#/10x Cell Plex oligo tag for multiplexing tissue sources into a single 10x load./#/|CMO307/#/10x Cell Plex oligo tag for multiplexing tissue sources into a single 10x load./#/|CMO308/#/10x Cell Plex oligo tag for multiplexing tissue sources into a single 10x load./#/|CMO309/#/10x Cell Plex oligo tag for multiplexing tissue sources into a single 10x load./#/|CMO310/#/10x Cell Plex oligo tag for multiplexing tissue sources into a single 10x load./#/|CMO311/#/10x Cell Plex oligo tag for multiplexing tissue sources into a single 10x load./#/|CMO312/#/10x Cell Plex oligo tag for multiplexing tissue sources into a single 10x load./#/|2nt-001/#/Used in conjunction with Histone antibody to capture and tag separate subcomponents of the epigenome. Allows for pooling of enriched cell samples into a single 10x load./#/|2nt-002/#/Used in conjunction with Histone antibody to capture and tag separate subcomponents of the epigenome. Allows for pooling of enriched cell samples into a single 10x load./#/|2nt-003/#/Used in conjunction with Histone antibody to capture and tag separate subcomponents of the epigenome. Allows for pooling of enriched cell samples into a single 10x load./#/|2nt-004/#/Used in conjunction with Histone antibody to capture and tag separate subcomponents of the epigenome. Allows for pooling of enriched cell samples into a single 10x load./#/|3nt-001/#/Used in conjunction with Histone antibody to capture and tag separate subcomponents of the epigenome. Allows for pooling of enriched cell samples into a single 10x load./#/|3nt-002/#/Used in conjunction with Histone antibody to capture and tag separate subcomponents of the epigenome. Allows for pooling of enriched cell samples into a single 10x load./#/|3nt-003/#/Used in conjunction with Histone antibody to capture and tag separate subcomponents of the epigenome. Allows for pooling of enriched cell samples into a single 10x load./#/|3nt-004/#/Used in conjunction with Histone antibody to capture and tag separate subcomponents of the epigenome. Allows for pooling of enriched cell samples into a single 10x load./#/|3nt-005/#/Used in conjunction with Histone antibody to capture and tag separate subcomponents of the epigenome. Allows for pooling of enriched cell samples into a single 10x load./#/|3nt-006/#/Used in conjunction with Histone antibody to capture and tag separate subcomponents of the epigenome. Allows for pooling of enriched cell samples into a single 10x load./#/
enriched_cell_sample_preparation_date,preparation_date,,Enriched Cell Sample Preparation Date,Enriched Cell Sample Preparation Date,date,,Enriched Cell Sample,Enriched Cell Sample,,,,,,,,
project_identifier,project,,The project this Enriched Cell Sample is for,The project this Enriched Cell Sample is for,text,,Enriched Cell Sample,Enriched Cell Sample,,,,,,,,
enrichment_population,enrichment_population,875f1c70-f5aa-45e3-94b9-5e482f6c4830,Enrichment population,Enrichment population,text,,Enriched Cell Sample,Enriched Cell Sample,,,,,,,,
histone_modification_marker,histone_modification_marker,,Histone modification marker,Histone modification marker,text,,Enriched Cell Sample,Enriched Cell Sample,,,,,,,,
dissociated_cell_sample_ids,dissociated_cell_sample_ids,,Upstream dissociated cell sample NHash ids,Upstream dissociated cell sample NHash ids,text,,Enriched Cell Sample,Enriched Cell Sample,,,,,,,,